{
  "schema_version": "1.0",
  "state_version": 69,
  "cycle_id": "actor-reset-off200-on200-20261012",
  "experiment_id": "EXP-ACTOR-RESET-OFF200-ON200-001",
  "status": "PI_REVIEW",
  "next_actor": "PI",
  "control_branch": "research-loop",
  "execution_worktree": "/nvme2/user/qyy/SafeVLA_actor_logits_p2_full400_20261012",
  "instruction_commit": null,
  "reviewed_result_commit": "b65cb07d87dc3321f79b89d9b1ffcde0ff2e1db3",
  "claim_id": null,
  "authorization": {
    "status": "NOT_AUTHORIZED",
    "approved_by": null,
    "approved_at_utc": null,
    "expires_at_utc": null,
    "scope": "RESEARCH_EXPERIMENT",
    "max_gpu": 1,
    "max_episodes": 400
  },
  "required_outputs": [
    "research/handoffs/actor-reset-off200-on200-20261012/RESULT_SUMMARY.md",
    "research/handoffs/actor-reset-off200-on200-20261012/RUN_MANIFEST.json",
    "research/handoffs/actor-reset-off200-on200-20261012/ARTIFACT_INDEX.json",
    "research/handoffs/actor-reset-off200-on200-20261012/REVIEW_NOTES.md",
    "research/handoffs/actor-reset-off200-on200-20261012/FROZEN_PROTOCOL.md",
    "research/handoffs/actor-reset-off200-on200-20261012/LOGGER_WAIVER.md",
    "research/handoffs/actor-reset-off200-on200-20261012/TASK_MANIFEST.csv",
    "research/handoffs/actor-reset-off200-on200-20261012/OFF_ON_RESULTS.md",
    "research/handoffs/actor-reset-off200-on200-20261012/VALIDATION_SUMMARY.md",
    "research/handoffs/actor-reset-off200-on200-20261012/GPU_QUEUE_REPORT.json"
  ],
  "updated_by": "PI",
  "updated_at_utc": "2026-10-13T02:55:25.682Z"
}
